data,app,type
Not able to sign in. Loading circle is spinning in infinite loop Edit: works after latest update,Samsung Health,problem_report
I like the app. But the heart rate and stress test features don't work on my HTC.,Samsung Health,problem_report
"It used to work properly, now I can upload any new programs under ""discover"". It simply says ""no new item"".",Samsung Health,problem_report
"except for keeping track of sleeping time and recording what you ate, this app is pretty useless now. the step counter is broken, it recorded 14 steps today while I was working and walking.",Samsung Health,problem_report
Before it would keep saying the application had stopped multiple times everyday when I was not using it. Now all I have is a green screen with the man running on it. Its not working.,Samsung Health,problem_report
"Unwelcomed automatically downloaded app behaves like a virus and keeps trying to open, even when disabled!",Samsung Health,problem_report
it doesn't work on S20 FE . It won't measure my heart  rate or Oxygen.,Samsung Health,problem_report
It does not keep the right track of how many miles you walk !,Samsung Health,problem_report
Wants access to make phone calls. Won't open without it. Upd: The answer regarding providing optimal experience is ot an answer at all. I don't need an experience when an app makes phone calls for me.,Samsung Health,problem_report
Aftr update my samsung watch failing to detect any activity pls fix the issue,Samsung Health,problem_report
I went on a 2k run and it said I got 52 steps,Samsung Health,problem_report
"Was in the top 5% of total users, now at 25% because is hasn't tracked my steps in three days!!!",Samsung Health,problem_report
This used to be a really good app. Worked all the time. But of late it's just not logging anything. Not even step count. Constant white screen. Have to force stop then restart. I'm going to look for another app that works.,Samsung Health,problem_report
"I used to trust this app, it was very good but recently has not been counting my steps property. I walked the dog for 80 minutes this morning covering six kilometres but the app recorded only 5 mins and less than 500 steps!",Samsung Health,problem_report
"After new update, I can't link with AIA vitality app.",Samsung Health,problem_report
"update has ruined the app, and made my s3 useless. Roll it back, or i will be trying new hardware. silllly, and it seema like i am not alone as the app score has gone waaayyyy down because of this reason.",Samsung Health,problem_report
"I cannot remove this damn app from my device!! I try to uninstal and it only allows uninstal for updates, to make things worse it boots up every time i look at the phone, even on calls...Infuriating!",Samsung Health,problem_report
Seemed great but for some reason it keeps telling me I'm over my calorie goal even though it shows I'm still way under in Weight Management. It was working fine until a couple days ago.,Samsung Health,problem_report
I'd love it but I can't track my heart rate and my stress levels on my Samsung a5 but my boyfriend can on he's s5 ,Samsung Health,problem_report
"It was amazing until steps stopped counting after phone software updates. Reinstalled the app twice, Paused and resumed step counting and all but still not functioning well. Using Mi Max, MiUI 8 here...",Samsung Health,problem_report
"I used this app on galaxy S6 app for years and that was awesome, Recently I've installed on my new phone. But step counter pause periodically and it counts maybe 1/5 of my steps. That's a pity I loved this app previously",Samsung Health,problem_report
"Won't let me varify the given code while setting up the 2 step varification, or if I skip it the app won't connect to my wifi. Would love to use this app.",Samsung Health,problem_report
I love this app. I only have one issue. I cannot seem to get my App and Watch to work as a Monday start. I have seen many people having the same issue. Please fix this I know many people would really appreciate this including me.,Samsung Health,problem_report
This app needs to be fixed #1 problem it doesn't accurately show how fast I run on the graph I'm sure also the mph or top speed isn't accurate this app needs to be fixed.,Samsung Health,problem_report
Unistalled up dates as latest update is useless missing features and not counting steps correctly fix it,Samsung Health,problem_report
Great app except that it sometimes doesn't count my steps right.,Samsung Health,problem_report
"I put my phone in my dog treat bag which is against my body when I walk. This app either doesn't register my walking like that or only only registers part of the walk. But, if the phone is in my purse in a shopping cart or registers. Very unreliable!",Samsung Health,problem_report
My 1 night of sleep gets recorded as multiple sleep cycles and broken up throughout. It's really irritating.,Samsung Health,problem_report
"It's Not working from past few months, not even starting, please do something about it.",Samsung Health,problem_report
"When the new day starts at midnight I already see 200kcal burned, even if the day just started and I didn't burn anything with training or just thanks to my basal metabolism, please fix this...",Samsung Health,problem_report
But then since the update it's no longer logging my steps correctly and I don't know how to fix it?,Samsung Health,problem_report
Can't turn off notifications. I've turned off everything I can find in the app but still get annoying daily notifications that I don't want.,Samsung Health,problem_report
But I work 3rd and it wont let me record my sleep. I sleep during the day  and it wont let me put it down to save it,Samsung Health,problem_report
walked 6 miles and it says I did 8. not vert accurate,Samsung Health,problem_report
Won't directly register my omron M7 Intelli IT HEM-7322T-E. But I have managed to link the omron app to this app. Sadly it won't import full history. But at least it's working now.,Samsung Health,problem_report
The new app is a total downgrade. Worse counting and no options to change your settings,Samsung Health,problem_report
After this update it says it cannot be open on a rooted phone. One problem: my phone isn't rooted...,Samsung Health,problem_report
I love this app but it doesn't work properly with my Lenovo device it crashed sometimes and didn't update my footsteps,Samsung Health,problem_report
Good but won't sync between phones with the same Samsung account even though my account sync is on,Samsung Health,problem_report
S5 sport...Lost the app with the update. I used this EVERY DAY! Not happy!,Samsung Health,problem_report
"I dont know y but since the update, my pedometer, and sensors dont work  anymore!",Samsung Health,problem_report
Nice app but I think it's fake.when I check my health sometimes it's say 68 sometimes 98 and sometimes 118 this fake or real I have note 4,Samsung Health,problem_report
I guess the app is okay but I dont wanna use it. I cant uninstall it and its always opening up and thats very annoying.,Samsung Health,problem_report
"Steps start get counting even when travelling in a car, bus, etc. PLEASE FIX IT. Thanks.",Samsung Health,problem_report
"I updated the app and it now wants me to set up two step verification. Which is fine, but after i confirm my phone number it just goes back to the previous screen and doesnt do anything",Samsung Health,problem_report
Quite often my Samsung Fiite doesn't connect with the app. I missed around 25k steps this month to no connection between my watch and app. What even a point if you trying to challenge someone to race,Samsung Health,problem_report
After install security setting by email not working. Save password button does not work. And open link in browser also does not work. So not possable to use this app. Just time waisting in downloading.,Samsung Health,problem_report
"Used the app on Galaxy S10 for counting steps and for monitoring my heart rate. Since last S10 update, heart rate monitoring no longer functions. Please bring it back. I need it to check my heart rate and not currently in the market to buy a watch.",Samsung Health,problem_report
Does'nt properly on phones other than samsung U need to fix this problem,Samsung Health,problem_report
"Did not want this. Cannot delete it. Cannot even turn out off. Google, block this app!",Samsung Health,problem_report
can't get mine you sync if i have to resign in,Samsung Health,problem_report
After this update my watch and Galaxy 7 edge do not communicate. Still have problems,Samsung Health,problem_report
One more update. Find a way to give steps for cyclists. There's no way people do hundreds of thousands of steps everyday. It seems dishonest that I don't want to be part of it.. uninstalling..btw the GPS seems to be working fine now.,Samsung Health,problem_report
I used to love this it no longer keeps track of steps.,Samsung Health,problem_report
"This was a very good app, however a week ago, I encountered a problem where my step count did not work and the app assumes that I have not been doing anything. Could you please check to see if it is some sort of glitch? Thank you.",Samsung Health,problem_report
"NOT GOOD, I TRY OPENING THE APP, BUT EXPERIENCING PROBLEMS, IT SAYS CONTACT Y'ALL! NO GOOD",Samsung Health,problem_report
"I used to love this app.. now it dosent even work properly. It dosent even count my steps sometime.. really frustrating, also weight management feature is no longer there with the new update.. pointless having this app anymore..",Samsung Health,problem_report
"The 2-factor authorization has basically logged me out of the app. Get the code on phone, entered the code, but the Verify button doesn't work.",Samsung Health,problem_report
"Hello samsung, I'm not able to work this app, showing like ""due to a new security policy, SH can't be opened on a rooted device."" Please help.",Samsung Health,problem_report
"This app never worked for me. I would put ""walking"" on and after 30 minutes it would tell me I'd walked 30 steps. Usless",Samsung Health,problem_report
After recent upgrade few days ago stress and heart rate sections do not work,Samsung Health,problem_report
"It's good , but I have problem I need some help  . When my phone in my pocket the program does not  count me steps . Why is that ?",Samsung Health,problem_report
"Like the app. Except for everytime I put a workout in the app, my step cals always disappear, and the app doesn't show all my step cal.",Samsung Health,problem_report
More bullshit taking up room on my phone that I can't take the stupid app off of,Samsung Health,problem_report
It was a great app. Was working well until I updated it. Now it won't even start. :(,Samsung Health,problem_report
"Settings is enabled but kept asking sms permission on my s7, hence couldn't connect with my friends who has S health.",Samsung Health,problem_report
After the last update the ecg stopped working it requires an update that according to the msg is not compatible with the zfold3 or watch 4 (com.samsung.android.shealthmonitor:2290:9908:25bc597b6003) Tried to get help and no response so far.,Samsung Health,problem_report
Using galaxy watch active with Pixel 3. No option in app to separate steps counted by my phone vs steps counted by my watch. it's either the phone or everything. Also cannot edit out miles of activity when it is obviously incorrect.,Samsung Health,problem_report
"I've had this before & lost an entire person by just walking 10,000 steps a day, but I'd actually topped it by 4000 extra steps so I'm happy to try to lose again so my surgeries go better than expected.",Samsung Health,problem_report
i have s6 edge but i can not delete the 2018 weekly summary records can u help ?,Samsung Health,problem_report
"The step counter stopped working for the second time. Each time i had to reinstall the app. I have a Samsung Galaxy S5, all software updated. Losing the progress details for what I had accomplished was annoying.",Samsung Health,problem_report
"Newer phone, sensor not working in app 9 of 10 times. Just updated app, will see if improved. App seems so-so thus far.",Samsung Health,problem_report
Same story... does not work completely. Does it only work on overpriced Samsung Phones. I regret that I still have a Samsung smartwatch. Just loading circle all the time.,Samsung Health,problem_report
The stupidest app there is even when ur lying on bed shaking the phone or in a moving car the pedometer keeps counting steps.... Total bullshit,Samsung Health,problem_report
Disappointed It is not trusted because its counting is wrong......even if you take phone in hand and move here n there it will count as a step,Samsung Health,problem_report
steps are accurate on mobile phone mode love the challenges the food calculator needs work alot of the nutrition information is incorrect making it unusable to me...,Samsung Health,problem_report
"After update ui last night (released via firmware update), step counting and account synchronizing has not worked till now. Hope to see bug fixed soon.",Samsung Health,problem_report
"I was happy with the app and it's functionality, but when I updated OS to Android 9 on my Pixel 2, the app stopped passively counting steps and would only count if I had the app open. The lack of passive counting has made this a lot less useful.",Samsung Health,problem_report
App stopped syncing with samsung gear fit2 pro after update. It was working perfectly fine before. I wish I can go back,Samsung Health,problem_report
This app started to kill the battery recently. It used to be a must-have app. But now it drains too much battery life.,Samsung Health,problem_report
I work a 12 hr shift and i walk 10 of those hours.  This doesn't count all of my steps. Not happy about the way it shows your rewards. Won't let you see each reward. Before update was better. Not excited about using this anymore.,Samsung Health,problem_report
Reset how many glasses I have drinking. If I choose 2 glasses and I go back to app after two hours it says 0 glasses water,Samsung Health,problem_report
This app requires permission to something but it doesn't say what. So it will not open. I used to use this but the last update killed it.,Samsung Health,problem_report
Used to be working...now can't open because it thinks my device is rooted which is not.,Samsung Health,problem_report
I had a galaxy s5 and this app tracked my steps extremely well. I have since replaced it with a galaxy s6 edge and the app is no longer sensitive enough to capture my true count with this phone . Please fix!,Samsung Health,problem_report
Having issues the app keep stopping when i try to open it.,Samsung Health,problem_report
was a good app but now it insists that my phone is rooted and keeps popping up errors ever 30 seconds when I'm not trying to use it. I had to uninstall because it became too annoying.,Samsung Health,problem_report
"I have used this app since 2017. Since the recent update, have more problems synching from the Fit. I have read many complaints recently and applied samsung response to correct .""""Nothing Worked"" Today, your rating has tanked to a 1 star from a 5 .",Samsung Health,problem_report
So frustrating.   I have been refusing the updates for a reason and did not give permission for this one.  Driving in car sometimes counts as steps also.,Samsung Health,problem_report
"When I measure stress out heart rate the screen sometimes freezes and I have to restart my phone. Otherwise, I like the app but wish there was a way to enter other exercises.",Samsung Health,problem_report
"The app will not open because it says my phone is rooted. However, my phone is NOT rooted. Because of this my gear S3 is essentially useless, as it will not sync with any other application.  Not happy Samsung.",Samsung Health,problem_report
For some reason it only loaded the first time I used it then I couldn't get on after that. I did an update and it loaded up again the first time but now when I open the app it won't get past the green start screen.,Samsung Health,problem_report
I bought a galaxy fit e and it's the app doesn't work it say there a problem. It does not connect.,Samsung Health,problem_report
Not tracking steps like it used to please fix it!,Samsung Health,problem_report
"All issues have been fixed. I love this app. However, the ""Smart View"" function isn't working from the last update. This function is really important to me, my phone is S9 plus.",Samsung Health,problem_report
"This app will not even open, it just says access denied, just a waist of time to try",Samsung Health,problem_report
"Inaccurate counts of everything. Steps are never correct, heart rate force closes the phone. Kind of useless.",Samsung Health,problem_report
Doesn't always record the correct number of steps. For me averages 1/2 what was actually done. Have to uninstall and re install to get it correct for a little while.,Samsung Health,problem_report
This app helps you alot to achieve your fitness targets i liked it alot..but don't know what happened audio guide is on and still not receiving workout informations at audio guide intervals..plz fix the issue.,Samsung Health,problem_report
I do not work out and it keep tell nice work or I'm on a bicycle and it been 4 years for that. Something need fix ASAP,Samsung Health,problem_report
"Stopped working. It used to be fine, but now it won't even open. It just sits there loading. I've tried updating to no avail.",Samsung Health,problem_report
Unfortunately it isn't recording my distances travelled properly. Yesterday biked over 10 km. The route showed on the map but distance recorded is 0.04km. This has also happened on recent walks.  Any ideas on why?,Samsung Health,problem_report
Half the time there are no search results for food and most of the time adding food doesn't works. It just buffers then stops.,Samsung Health,problem_report
I am not able to login. After inserting credentials the process remains loading without concluding.,Samsung Health,problem_report
I've been walking all day and I look down at the tracker to see how I'm doing. 178 steps and hasn't budged since this morning. Uninstalling.,Samsung Health,problem_report
Really want to use the app how ever it won't let me sign in. I've reset my phone. Cleared my cache deleted and re added the app and still won't allow me to log on,Samsung Health,problem_report
"Inaccurate mile count, also inaccurate speed . Says I am walking 3.7 miles per hour and it is closer to 3 mph. Irritated!",Samsung Health,problem_report
Not accurate. Topped my weekly goal by 24% additional yesterday. Today sends me a 'reminder' that Ive been more innactive than usual. Even though my weekly goal score will be 15% higher than required. Useless if inaccurate.,Samsung Health,problem_report
Very poor. Failed on a consistent basis to measure step activity.,Samsung Health,problem_report
I had this same app on my old phone and it would check my oxygen as well as my pulse. Now that I have a new phone it doesn't show either! Ugh this is very aggravating,Samsung Health,problem_report
"sine I bought samsung s7 this app would not to open,shi say the device is rooted but device is not rooted,help?",Samsung Health,problem_report
It's good I liked the heart rate and stress measuring but there r problems with step counter,Samsung Health,problem_report
last update sucks telling it doenst work on a rooted phone lol i havent even tried rooting and yet it says my phone is rooted,Samsung Health,problem_report
Freezes my phone and reboots it using the stress test,Samsung Health,problem_report
No longer counts steps.  Garbage application.   Edit: The troubleshooting doesn't fix it.,Samsung Health,problem_report
It was great for tracking steps but now the step counter isn't resetting each day. It doesn't work. Update: Samsung responded very quickly for a fix to the problem and it was able to resolve the issue and now it works better.,Samsung Health,problem_report
Love using the app. One problem since the last update my Samsung heath and discovery won't sync at all. Samgsung health doesn't see any 3rd party apps associated with Samsung health,Samsung Health,problem_report
"If your heart rate is too high, like after a good cardio sesh it wont give a bpm, which is ridiculous, just tell me how fast its going, damn.",Samsung Health,problem_report
"Can't measure anything (i.e., heart rate, stress, oxygen); only measures steps and sleep. Why?",Samsung Health,problem_report
"Blood oxygen measurement was removed in the latest update, no reason was given. On some phones it's apparently still available under the Stress section but my phone doesnt have that for some reason.",Samsung Health,problem_report
"Ever since the recent update my step count has decline by at least 10% walking the same journey. Have cleared cache and restarted phone, but same result.",Samsung Health,problem_report
Tool a 8 hike mile this app showed less than 3 miles. Reinstalled app now seem to be working correctly.,Samsung Health,problem_report
"All the sudden the app step counter is only displaying mobile phone steps and when you switch to show all, it won't load up. After years of this app, that shouldn't become an issue. Fix it.",Samsung Health,problem_report
This ap does not count steps correctly when challenging others. Sometimes its over and sometimes under. Makes challenging friends useless,Samsung Health,problem_report
"I love this app but since my last phone update, the app is saying I'm burning 6000 calories by the end if the day! I wish, lol. Hopefully this gets corrected soon.",Samsung Health,problem_report
Suddenly it stopped counting steps! I even installed it again but nothing.,Samsung Health,problem_report
the app keeps saying it cant be opened from a rooted phone and its randomly popping up!! plz fix,Samsung Health,problem_report
"I like the original set up! Since the big change, I can't find anything such as how to change my goal of 10,000 steps to something different. I just messed with it for over 10 minutes and got nowhere. Please change it back!",Samsung Health,problem_report
It keeps getting stuck at the steps screen for me. Keeps loading forever and hangs :( the rest of the app works fine though..,Samsung Health,problem_report
Great App but last 2 weeks there is a problem apply to update through Samsung Galaxy Store. After download is finished the app keep crushing when it tries to be applied on Galaxy Watch,Samsung Health,problem_report
I cant login with samsung account. Due to the registration proses using some weird language.,Samsung Health,problem_report
hi i am facing some issue with this app..the pedometer is not showing when the scree locked..i am using samsung a5 handset.,Samsung Health,problem_report
"It worked fine for 2days from the installation after that its showing Loading.. When I opened the app, and all so not counting my steps properly in my J5. Pls help...",Samsung Health,problem_report
This AP constantly pops up when I'm on the phone and reinstalled itself several times after deleting! Help me get rid of this spamming spyware!!!,Samsung Health,problem_report
I cannot link the samsung health to my philam vitality. Kindly help,Samsung Health,problem_report
All of a sudden not working saying error due to rooted phone. tried clearing cache uninstall and install again but still the same problem. so irritating pops up randomly all the time,Samsung Health,problem_report
"I thought it was synching to Samsung, but when I did a system rest on my S5, it couldn't find any data to synch back to my phone. Data was just all gone. What a bummer.",Samsung Health,problem_report
Was a great app until last update I am unable to use as access denied unauthorised changes were made to phone apparently that's the message I am given every time I try to use it,Samsung Health,problem_report
"I don't know if it was due to the update, but all of a sudden my steps are not being tracked. I will go the whole day walking and it will say I only took 43 steps!",Samsung Health,problem_report
Asked for update so I reset it and it won't work.. so now I'm going to have to find a different app.,Samsung Health,problem_report
When I input the code for the two step verification it just loops back to the beginning. I can't get past it.,Samsung Health,problem_report
It stop running on the work out and so it does not up date the work as far as for steps,Samsung Health,problem_report
Can't sync with Nike run anymore. Either allow SyncMyTracks to run properly or add Nike run to your app. You can't take away both.,Samsung Health,problem_report
"Kills my battery,  force restarts,  inaccuracies.  Please get it off my phone",Samsung Health,problem_report
The new version doesn't record walking or running automatically neither it is able to record ur sleep automatically. Just consuming power in the background.,Samsung Health,problem_report
Cant get pass the verification for phone number. Great app. Just broke it with the last update however.,Samsung Health,problem_report
the only thing I have a problem with is the that the food caloric measurements arent accurate. I added in and item that was on the list and it didnt add in the protein counts.,Samsung Health,problem_report
"Km count is totally wrong-where in reality I have 15 m,app counted 2 km!!  Pedometer too not trustable,walked with friend the same amount-very long  distance,I had ~12000 steps, she - 30000. At the end of the walk different  notifications about different length.",Samsung Health,problem_report
Update broke app. Won't let me set up 2 step verification. Can't get into the app. Please fix this.,Samsung Health,problem_report
Worked good before the update but crashes my phone now  everytime I take my heart rate.,Samsung Health,problem_report
"The app idea is good, but implementation could be better: often gets stuck",Samsung Health,problem_report
