data,app,type
"This is a bad app, it doesn't count your steps correctly and it closes by itself.",Samsung Health,problem_report
"I don't want to use this app so I uninstalled it a few days ago and turned off the auto-update feature, but I just found it reinstalling itself. Not impressed.",Samsung Health,problem_report
This app is getting slower and slower. It just hangs when I come back from my walk. I do not have the problem if I use any of the other running apps.,Samsung Health,problem_report
it will not go away and keeps downloading even tho i keep uninstalling,Samsung Health,problem_report
First time user....But would recommend this app is waste of time...Can't sync Note 9 with Samsung gear.....Congratulations Samsung you guys are going in right direction...,Samsung Health,problem_report
Doesn't detect GPS even im outside. Im not sure why,Samsung Health,problem_report
"It sometimes doesn't record my steps. I just took the dog for a walk. Before, I had 66 steps. When I came back? 66 steps. This isn't tge first time.",Samsung Health,problem_report
How can it be made silent. am unable to.stop its talking.,Samsung Health,problem_report
It sucks know it keeps changing my step target and says updating,Samsung Health,problem_report
Since 10/20 update my watch is no longer connecting to my phone.,Samsung Health,problem_report
i have a gear and want use .. after install i open and popup come out show the app stop working..,Samsung Health,problem_report
"The app says one of the accessories is a samsung heart rate monitor so I ordered it,  doesn't use the heart rate monitor for anything,  big bummer and misleading",Samsung Health,problem_report
"About 3/4 of the time that I try to check my heart rate, it restarts my phone.",Samsung Health,problem_report
All good but distance showed and time for it is wrong! Did 45 min of walk showed like 13.,Samsung Health,problem_report
I can't get it to open or connect. It just says server error.,Samsung Health,problem_report
"Not consistent. Ran it side by side on my old Samsung J7 & my new Realme 8 5G with same data for a week, and at the end of the day while the Samsung registered nearly 2000 steps, on the Realme it didn't even register 100 steps.",Samsung Health,problem_report
When I'm in the car it counts steps and eventually says my target is reached!it's not right at least we should always be carefull to turn it off when on the car.,Samsung Health,problem_report
I am unable to connect my huawei band 7. The app does not show the band at all. Tell me what to do now.,Huawei Health,problem_report
"Sleep data ok on watch but not logging on health app still, even after update too current version ending 331, not worked all this year . App will record naps ok now, Still not sorted .",Huawei Health,problem_report
"overall, the app gives me all the data I need. but lately, I have been experiencing hanging and crashing upon opening. please resolve this issue. thanks now, it can not record my activity if I am not connected to the internet..",Huawei Health,problem_report
App doesn't save my height and weight. I have tried multiple times. Can someone help with this?,Huawei Health,problem_report
"App contains only walk, run and bike activities. I can't sync with linked Google fit account. No heart rates, no sleep data",Huawei Health,problem_report
Doesn't work with my GT watch anymore. Keeps saying update in appstore but there there is no update available to fix. Updated app doesn't fix.,Huawei Health,problem_report
"Not able to connect my watch gt2 with this app,I don't know how to resolve it",Huawei Health,problem_report
Synchronisation with google fit and other apps is not working.,Huawei Health,problem_report
Can't sync sleep data since last update (on Samsung Galaxy J6+),Huawei Health,problem_report
"Useless since last update. It won't sync any data, so everything previous is gone. When I want to see sleep records, it halts immediately. Reinstalled it today, everything is the same. Left a review yesterday, that has also been removed...",Huawei Health,problem_report
"Not able to update device list. Purchased honor band 4, to get it paired it is required to update the list of devices but always getting message of no internet connection, but internet connection is working.",Huawei Health,problem_report
"Does not work with the Band 3, please advise if upgrade is happening and when otherwise I've made a mistake by buying the band 3!",Huawei Health,problem_report
Just bought the Huawei scale 3 and I can't find it on the devices list... So i can't pair it and can't use it,Huawei Health,problem_report
Honor band 5 is not showing in App despite several attempts to Add device in Smart Band. Only honor 3 is shown and on selecting same when trying to pair with Honor Band 5 it does not.,Huawei Health,problem_report
"Terrible. On Honor Magicwatch 2 dont have Weather, keep saying check Internet connection even Internet is turned on",Huawei Health,problem_report
"TruSleep data now available again thanks to bug fix so increased stars. A great feature for me is I no longer miss my phone calls, as my band alerts me to incoming calls.",Huawei Health,problem_report
everything is awesome but i can not download or update watch faces ... fix it,Huawei Health,problem_report
App not working . Not able to connect with my Huawei band 4 . Please fix it,Huawei Health,problem_report
"I was happy for the whole year with this app until the latest update which made me lose all my data that I've been recording for more than a year. I've been also trying to open it and it doesn't work, my devices have disconnected",Huawei Health,problem_report
You guys screwed the app... Not able to open after recent update... Asking to update from Huawei app store so funny...,Huawei Health,problem_report
"After updating app, it's not connecting, even it's not showing device, then i thought i have to reset it (Honor band5), then also not connecting, worst experience, worst app. Now this band became useless. You Busted why you people taking money from us.",Huawei Health,problem_report
"The general performance works great except the music app, when you take control of the music from the band it does not work some times, the band shows a message, please start the music app on your phone.",Huawei Health,problem_report
When i open app they said download huawai app gallery then i download that app but it doesn't work please solve this problem i have to use my honor band 4.,Huawei Health,problem_report
"Entirely offline? Can't connect to Google Fit, can't store data online ...",Huawei Health,problem_report
Continually crashing since Android 10 update! Even the update with the bug fix hasn't fixed the issue!,Huawei Health,problem_report
I can install the app but I can't log in,Huawei Health,problem_report
Just got a watch gt and it doesn't show on the list. Means I can't even use the device as it won't let me set it up.,Huawei Health,problem_report
"Looks like the app is nolonger working on Samsung phones...S10, or is it me? It tells me to update from Huawei appGallery to a newer version.4.0.0. Google playstore must just remove this app here, it is nolonger working on Android phones.",Huawei Health,problem_report
"Easy to use app, but has numerous bugs. The biggest of which being that it refuses to accept that you have an Internet connection, and when you try to press the button that lets you change the watch face, you are presented with the white screen of death.",Huawei Health,problem_report
I have just updated the app but it is not opening.,Huawei Health,problem_report
I am happy with the app but Don't buy huawei band 4 because it is not beetter then mi band 4 huawei band should get more improve in updated not even amoled or not our own wallpaper,Huawei Health,problem_report
"Disappointing, waste of time energy and data do not download this fake app not responding to network at all",Huawei Health,problem_report
The Colorband A1 app was 1000 times better. The sleep tracking doesn't make sense and my band doesn't count steps when I push my baby in a pram. The A1 did. Sometimes newer technology isn't necessarily better.,Huawei Health,problem_report
Since daylight saving finished. It doesn't record an accurate sleep time.,Huawei Health,problem_report
After thr latest update I can't access the app. It doesn't sync with Google fit app either.. I have bought an expensive huawei smart watch which is just a digital watch for me.. Dear huawei please fix the bug. Disappointing for a big company like huawei to do such things.,Huawei Health,problem_report
"Flat out doesn't work. Profile never ever saves, you can reset it 10 times doesn't help. So many glitches too many to mention. What a pity, good looking app that is so frustrating because it just doesn't work. I use it only for workouts as the rest is useless.",Huawei Health,problem_report
Cannot install Apps in my gt2 pro using my samsung phone,Huawei Health,problem_report
"Does not worki properly, doesn't find my device, can't Connect with it.",Huawei Health,problem_report
"Can't use my Fitbit. Any time I'm typing using the keyboard, phone defaults to home screen. Have to push everything 3 times to get a reaction. Not impressed. This is my 3rd Huawei, it will be the last.",Huawei Health,problem_report
After update to version 9 it drains battery from time to time. Also smart alarm doesn't work at all wit huawei bands.,Huawei Health,problem_report
Please fix the connectivity issue as it gets disconnect after some time and i need to reconnect it manually previously it was working fine but with new update i need to struggle with this issue which is annoying kindly fix it!,Huawei Health,problem_report
This app not properly work and don't cpunt step time taken long plz download Samsung Health.,Huawei Health,problem_report
"Dont work well with samsung galaxy s8!cant change watch face in app,cant uppdate watch!why?",Huawei Health,problem_report
"i am having trouble pairing with Honor bt scale(AH100), is there anyway to pair without going thru update checking all the time?",Huawei Health,problem_report
I just updated health App yesterday and your app mention that we need new version of mobile 4.0 which is not available in Android phone . My all previous data is of no use . What I gonna do with your watch without app ? Please fix it,Huawei Health,problem_report
I am not able to open this app on one plus7 .pls help,Huawei Health,problem_report
Have bug and problem on notification panel...please check for solve this.thanks,Huawei Health,problem_report
Stopped connecting with my one plus after recent update. Cannot find when pairing,Huawei Health,problem_report
I cant pair my honor band 5... Its says update to 4.0.0.sth .... I hate this app... Got a mew product and it doesnot work ...,Huawei Health,problem_report
Doesn't even load or open on Galaxy S20. I have a GT Pro 2 watch that i can't even setup. Appalling!!!!!,Huawei Health,problem_report
Can not enable continuous heart rate monitoring. Connected with honor band 4-906,Huawei Health,problem_report
Watch faces for my honor band 5 aren't showing.... It says server error....,Huawei Health,problem_report
Love this app but the sleep sync from my Gt2 watch hasn't worked since going into 2020!,Huawei Health,problem_report
Brought the same Brand scale . But it can not connect.,Huawei Health,problem_report
Stopped Working. After the latest update it has stopped Working on my Oppo Reno 10x Zoom with Android 10. Please do something so that it starts working again. Before it was working perfectly fine.,Huawei Health,problem_report
App was perfect up until the last update.. Now it will not even open with out giving a era message. I'm going to delete if its not corrected by Monday.. 4/27/2020..,Huawei Health,problem_report
After the update watches face option is not showing. Worst application ever i have used MI band but never face such type of service.,Huawei Health,problem_report
Crashes on P20 Pro when you click to see the details of the individual exercise records.,Huawei Health,problem_report
It says update Your App but i installed the recent app from playstore,Huawei Health,problem_report
Loses connectivity from smart band far too often and is very difficult to reconnect.,Huawei Health,problem_report
Faces options / add new face etc have disappeared for my Huawei GT2. I cleared the cache etc with no luck. Please fix it asap,Huawei Health,problem_report
Not good at all. My monthly report for April shows the same stats which were there for March month. Recommended courses also does not work properly.,Huawei Health,problem_report
The app constantly unpairs with my band 6 and whenever you play you music on your phone it doesn't reflect on the smart watch.,Huawei Health,problem_report
The update is unable to store any data it does not show any thing just the step count for the day destroyed the app,Huawei Health,problem_report
I have a blackberry dtek 60 and honor band 5 . But i cant change my watch face in this app. Plz help me to fix this problem . Tbx,Huawei Health,problem_report
Automatic log out now I can't login or do anything if I uninstalled all data will be lost wrost app,Huawei Health,problem_report
I use this app with Honor band 5 and after my band to lasted version my band 5 turn to brick mode how can i fix this,Huawei Health,problem_report
"Still 1star, sleep app is/I'm understanding it now, but my Honor band 5, is miss reading the step count, out by 133steps, I found out yesterday. Can you fix it PLEASE???",Huawei Health,problem_report
"Good for a lower end fitness tracker app, but sync to Google fit and myfitnesspal is broken beyond being useful.",Huawei Health,problem_report
Not able to access the huawei health... it asks for installing Huawei app gallery but could not find it in playstore. Please help me for the next steps.. I am not able to access health app at all..,Huawei Health,problem_report
The sleep or steps data is not in sync properly with in the app.,Huawei Health,problem_report
"Can't find WhatsApp, Facebook or Instagram on the app for notifications. Everything is enabled and still not showing, its useless when it comes to notifications and I keep having to reach to my phone to check if got any... Not good when working out.",Huawei Health,problem_report
This is spy app. Request to access too much thing Disconnect many time and do not auto reconnect.,Huawei Health,problem_report
No more updates? I guess I have to throw this watch. ,Huawei Health,problem_report
Does not see Huawei band 4 or list in the band section,Huawei Health,problem_report
"I have a Honor band 5 , not able to see it in the app to connect my band nor able to update the device list",Huawei Health,problem_report
Having lots of problem in operation for heart rate monitor. Sometimes work and breaks in between. Not consistently monitoring while wearing the watch.,Huawei Health,problem_report
I heared customers out of China could use new watch faces but I couldnt find shuch ability. Also weather notification dont work. I am disappointed really.,Huawei Health,problem_report
This will not connect to my honor smart scale ah100. Please fix,Huawei Health,problem_report
It's asking to update most recent version. I have updated it but no use.,Huawei Health,problem_report
App doesn't not work on my poco X2 I don't able to connect my honor 4 band,Huawei Health,problem_report
I can't use the application because of updates....they ask to update 4.0.0.in HUAWEI App gallery but I I using Samsung...in Google play store there is no updates available...so it's not fair....really disappointed...worst service ....,Huawei Health,problem_report
"Huawei takes Huawei Wear off the play store, now Huawei Health does not support my talk band b2 yet Huawei Health tells you to use an app that does not exist on the play store",Huawei Health,problem_report
Useless. Impossible to set correct profile info. Always defaults back to 15 feet 3 inches height and 43 lbs weight.,Huawei Health,problem_report
"iOS version is as good as Chinese communism, doesn't work at all",Huawei Health,problem_report
no dark mode no achievement recorded no weekly / monthly target shown. no stress data syncing with running band takes a hell lot of time. pls fix this asap in new update.,Huawei Health,problem_report
I can't receive message notifications on my Honour band 5. Everything else seems good so far.,Huawei Health,problem_report
"Unable to use the app as it says a 4.4.0 version is required, which' isnt available on app store.i am unable to use honor band 5.such a scam",Huawei Health,problem_report
"Last update bring cool view, but It cannot connect/pair with smart band ""my  band 2"" it will be very good if this can be available on the next update",Huawei Health,problem_report
The sleep app is not updating on my android phone. It suddenly stopped. The watch Huawei GT 2 is good. But there seems to be bug in the App.,Huawei Health,problem_report
In this version i can't check my sleep data! On the watch displayed info but when i try to get data in my application i cant get it! To write me invalid sleep data when try to synchronise,Huawei Health,problem_report
"A failed application in every sense of the word, data such as weather is not synchronized and also does not link with the band at the required time",Huawei Health,problem_report
"Really!!! I cant even log on to the app due to ""netrowrk error"" when my wifi is running perfectly fine, this is RIDICILOUS!!!!! Ive been trying to log in for 4 days now",Huawei Health,problem_report
Not able to login after reinstalling the app please help,Huawei Health,problem_report
Can't connect or pairing to huawei smart body fat scale,Huawei Health,problem_report
App not working. Asks to install mobile services. After installing the same issue persists.,Huawei Health,problem_report
"Was an ok ap until the last update. No it's constantly loosing connection. Also won't let me purchase new watch faces. Frustrating. New update today, now it just hangs on the start up screen. Reducing my rating",Huawei Health,problem_report
Failing to update the device list despite my strong internet connection. And this is not even a new bug. It still keep coming up whenever I install this app again to my phone. Utterly useless Huawei!,Huawei Health,problem_report
Add Tecno mobile features in this app. I've band 6 and I'm having identification error,Huawei Health,problem_report
Adding photos for watch faces not available in India. Please fix it soon.,Huawei Health,problem_report
Asking mobile services 4.0 or more. Whereas available version on playstore is 3.0,Huawei Health,problem_report
"Was working with my Huawei wrist band and Samsung phone for 6 months and after software upgrade, doesnt work at all !!!! Why ....??? Do I have to throw away my wristband or my phone ???",Huawei Health,problem_report
"It was good until the last update,after that the sleep recording is not working. Please fix it.",Huawei Health,problem_report
This app is so hard to sign in. It just a watch app. Not a bank app. If i can i want to give this app 0 star. Please fix it. I dont want to buy any watch from huawei. It so annoying.,Huawei Health,problem_report
Unable to connect honor band 4 with the app.. Now what I will do just tell..,Huawei Health,problem_report
Great step counter and GPS but terrible sleep anyalse some mornings I wake up and look at my phone and it thinks I'm still skeeping....,Huawei Health,problem_report
Hi. My device stop having the function to measure SpO2 level. It's Huawei Honor band 6. Please fix this.,Huawei Health,problem_report
Was working fine until I got a new phone but now my band 4 pro won't pair with the app. Sort it out,Huawei Health,problem_report
The app is not working. It's asking all the time to update through Huawei App Gallery which is not available on play store. I cannot synchronize my Huawei Health Band 5 to the app. What's the use of the app if we cannot even use it!,Huawei Health,problem_report
The petal map is not working in Huawei gt 2e.. kindly fix it asap.. navigation is very much needed..Its showing its not available in your country..Kindly launch it for India ASAP.,Huawei Health,problem_report
Its not working properly. Always show permission needed even after allowing all the recommended,Huawei Health,problem_report
I have GT watch in was the blutooth connected automaticlly..recently i hv to connect manually after while disconnected..pls fix it,Huawei Health,problem_report
"The app suddenly stopped working for me, erasing all my data. Tells me.to login to my Huawei ID and won't let me click anything. Very disappointed",Huawei Health,problem_report
"the update was bad, i have walked 12,000, 11,000 , 10,000 and it recorded small very inaccurate.",Huawei Health,problem_report
After reinstalling app my all data was gone No support for data storage in cloud or google account,Huawei Health,problem_report
Not able to find my honor band 5 in the device list,Huawei Health,problem_report
Didn't upload my sleep data since January 1 2020 from my Huawei band 4,Huawei Health,problem_report
Horrible app. Doesn't count the steps & the distance in minutes properly at  all. Very very bad app. Needs immediate rectification.,Huawei Health,problem_report
very disappointed after update because can't connect my Band 3. lousy...,Huawei Health,problem_report
It worked fine for a while but not my device won't pair with the app so its useless to me. Can't find any help to fix it either.,Huawei Health,problem_report
Please provide necessary updates.... Lots of issue in the app,Huawei Health,problem_report
Watch faces cannot be uploaded. Used to work good on Galaxy note 10 plus but not anymore .,Huawei Health,problem_report
this app is good but some time the app's pair button does not touch so I am giving 3 ,Huawei Health,problem_report
"Was working well until the GPS feature seemed to disappear. Midway through  a several week long marathon training programme, the app now no longer  tracks distance correctly, failing to display any map data at all.",Huawei Health,problem_report
Requires latest version of Huawei Mobile services that has to be downloaded from Huawei App Store...and is not available on Google play store...not acceptable....,Huawei Health,problem_report
"Rubbish can't connect my Huawei watch to my Samsung, don't get",Huawei Health,problem_report
"Please fix, i can't change or download new faces. It says unstable connection but I have stable internet.",Huawei Health,problem_report
"Cant pair my band to my mobile, app sees the band but cant pair. What a joke.",Huawei Health,problem_report
My band is useless as this app is not working at all. Asking mubile Services 4.0 and it's not available at playstore. I don't know which kind of services you are providing. I am norlt gonna recommend to any to buy Huawei products.,Huawei Health,problem_report
Since the last update my health app doesn't work as i open it close by itself... Kindly fix it,Huawei Health,problem_report
This is not connect to my band but I will try to pair and it is paired to my device,Huawei Health,problem_report
"Connects well on xperia 10 phone and gt2 pro watch, good charts and map to reference workout. The hight and weight setting don't set properly, only fault.",Huawei Health,problem_report
Way to ruin your reputation. I couldn't even use my band to check the time now thanks to your stupid updates.,Huawei Health,problem_report
After the update the app keeps on telling me the app is unable to connect to the internet and it closes on its own,Huawei Health,problem_report
"I have changed my mobile phone, to redmi note10, now my cycling could not be tracked by this app. I'm using Huawei band 2. No response from Huawei Health team today is 19 Feb. 2022",Huawei Health,problem_report
Old app is good don't update the app lot of bugs with new app . Downgrade  the app to march 2017 it doesn't track phones pedometer,Huawei Health,problem_report
Worst app ever . Every time I login it show to download more recent version n there is no recent version available on play store n there is no huawei app gallery. Fix this bug immediately or give my money back for my honor band5,Huawei Health,problem_report
"Not happy as I cannot pair my honour band 5, waste of time and money sending band back for a refund.",Huawei Health,problem_report
The app has to connected manually watch to transfer Dat from the watch,Huawei Health,problem_report
Can't seem to get this app to work in realme phone. No notification,Huawei Health,problem_report
an app where i have to keep reinstalling since my honor band 4 keeps disappearing. hassle. fix that bug already. make this app great again,Huawei Health,problem_report
In add section it is not showing honor magic watch 2 then how do we connect the watch to this app,Huawei Health,problem_report
It did not work on motorola one vision. It was show that need new version of app gallery which i installd but even that it continue to show the same. So i installed HMS core and now works perfect. But yes it drains the battery,Huawei Health,problem_report
"Got the Huawei watch, like it but app does not show heart rate results, why??? Surely it should be base function of device and app????",Huawei Health,problem_report
Watch not connecting automatically on oppo device please fix issue,Huawei Health,problem_report
Realme xt not supported watch faces and dark mode in honor band 5 plz do something I only have realme xt phone,Huawei Health,problem_report
All YouTube videos talk about a large watch face library in the app for the fit... I do not even have watch faces in the app at all... I'm using a brand new fit watch and the latest app and firmware... Very disapointing,Huawei Health,problem_report
After update apps can't run in background when exit from the app,Huawei Health,problem_report
Don't buy Huawei Honor Band if you don't have a Huawei Phone. Waste of money because it won't work,Huawei Health,problem_report
